{
  "schema_version": "1.0",
  "event_id": "aaaaaaaaaaaaaaaaaaaaaaaaaaaaaaaaaaaaaaaaaaaaaaaaaaaaaaaaaaaaaaaa",
  "scope_id": "demo-phase0",
  "sensor_id": "zeek-offline",
  "run_id": "phase0-v1",
  "event_kind": "connection",
  "event_time_us": 1791028801010000,
  "original_timestamp_us": 1791028801000000,
  "ingested_at_us": 1791028860000000,
  "published_at_us": 1791028860001000,
  "time_basis": "connection_activity_end",
  "source_ip": "192.0.2.10",
  "destination_ip": "192.0.2.20",
  "source_port": 40000,
  "destination_port": 8000,
  "protocol": "tcp",
  "zeek_uid": "fixture-uid",
  "provenance": {
    "log_kind": "conn",
    "source_generation_id": "phase0-conn-v1",
    "record_offset": 0,
    "zeek_version": "8.0.10",
    "capture_id": "phase0-controlled-network-v1",
    "input_mode": "controlled_pcap"
  },
  "connection": {
    "state": "REJ",
    "duration_us": 10000,
    "orig_bytes": 0,
    "resp_bytes": 0,
    "missed_bytes": 0
  },
  "dns": null
}
